id,name,published_at,url,area_name,salary_from,salary_to,salary_currency,employer_name,employer_url,snippet_requirement,snippet_responsibility,address_raw,address_lat,address_lng,address_metro_station_name
78177328,Бизнес-аналитик,2023-03-20T13:09:13+0300,https://hh.ru/vacancy/78177328,Москва,100000.0,120000.0,RUR,Кадровая компания Вераль,https://api.hh.ru/employers/5288296,"Опыт работы аналитиком (в отделе продаж, в торгово-производственных компаниях, возможно в сфере ИТ). Владение компьютером на продвинутом уровне: MS...","Анализировать изменения рынка, на основании данных предлагать действия по увеличению доли нашего бизнеса среди конкурентов. Анализировать продажи: с чем может...",,,,Дмитровская
73237947,Ведущий веб-аналитик,2023-03-21T16:16:48+0300,https://hh.ru/vacancy/73237947,Москва,,,,S8 Capital,https://api.hh.ru/employers/3565331,"Умение обрабатывать большие объемы данных, делать выводы. Умение технически описывать задание для ИТ подразделения по сбору данных для БД и...","Создавать и настраивать (события, цели, custom reportsdimensions) счётчиков веб - и мобильной аналитики, а также проверять корректность собираемых данных. ",,,,Деловой центр
69144700,Продуктовый аналитик в команду VK Чекбэка,2023-03-14T15:58:54+0300,https://hh.ru/vacancy/69144700,Москва,,,,VK,https://api.hh.ru/employers/15478,Разбираетесь в математической статистике.,"Формировать data strategy, поддерживать и развивать структуру данных и событийную модель. Понимаете на базовом уровне, как можно монетизировать приложения с...",,,,
77484157,Бизнес-аналитик (проекты с государственными заказчиками),2023-03-21T13:33:11+0300,https://hh.ru/vacancy/77484157,Москва,200000.0,250000.0,RUR,Clean Data,https://api.hh.ru/employers/6053285,"Умеете быстро разобраться в функционале готового продукта, его возможностях и ограничениях. Владеете SQL для анализа данных на хорошем уровне. ","Много общаться, искать и понимать боль заказчиков. Собирать и анализировать бизнес-требования. Разбираться в процессах заказчика. Готовить детальные требования для...","Москва, Якиманский переулок, 6",55.734091,37.610179,Октябрьская
73888466,Системный аналитик (DWH),2023-03-17T09:41:49+0300,https://hh.ru/vacancy/73888466,Москва,,,,Тинькофф,https://api.hh.ru/employers/78638,"Высшее техническое образование. Хороший уровень SQL. Базовые знания ETL и проектирования DWH. Коммуникативность, ответственность, аналитический склад ума. Опыт работы в...","Активно развивающийся Data Governance. Дружная команда профессионалов, готовая обучить всему необходимому. Системный анализ источников данных. Системный анализ бизнес - процессов. ","Москва, Замоскворецкая линия, метро Водный Стадион",55.840209,37.486616,Водный стадион
76952734,Аналитик,2023-03-16T10:00:07+0300,https://hh.ru/vacancy/76952734,Москва,,,,Группа Компаний Мечел,https://api.hh.ru/employers/2931950,"Опыт работе с массивами данных. - Логическое мышление, способность анализировать, выявлять узкие места и находить способы их устранения. - Желание и умение...","Сбор, обработка, нормализация и обогащение информации о запасах и реализации предприятий Группы (Data engineering). Обязанности: Консолидация данных, анализ, формирование отчетности...","Москва, Красноармейская улица, 1",55.7968,37.549453,Динамо
73888455,Business Data Engineer,2023-03-17T09:41:46+0300,https://hh.ru/vacancy/73888455,Москва,,,,Тинькофф,https://api.hh.ru/employers/78638,Высшее техническое образование. Опыт работы с базами данных в качестве разработчика от 1 года. Свободное владение SQL. Опыт проектирования объектов...,"Быть экспертом по данным: помогать аналитикам в решении вопросов с источниками данных, моделью данных DWH. Разрабатывать витрины в помощь аналитикам. ",,,,
71494399,Аналитик SQL в отдел управленческой отчетности (Финансовый департамент),2023-03-15T10:53:17+0300,https://hh.ru/vacancy/71494399,Москва,,,,Банк ВТБ (ПАО),https://api.hh.ru/employers/4181,"Опыт работы в качестве бизнес-аналитика с реляционными базами данных (используется Teradata, PostgreSQL, MS SQL Server). Практический опыт построения и...","Выполнение ad-hoc запросов: по бизнес-описанию сформировать sql-запрос к базам данных, осуществить сборку данных, валидировать с точки зрения...","Москва, Пресненская набережная, 10с1",55.748914,37.535475,Деловой центр
77988995,BI разработчик,2023-03-13T15:56:59+0300,https://hh.ru/vacancy/77988995,Москва,,,,"DODO BRANDS (Dodo Pizza, Drinkit, Doner 42)",https://api.hh.ru/employers/1520838,...данных. Наш стек: Хранение сырых данных в Data lake. Обработка данных Databricks. Хранение витрин Azure Data Explorer. Для визуализации данных...,Разработка аналитических отчетов и дашбордов. Анализ данныхпроверка качества данных. Развитие и поддержание в актуальном состоянии системы дашбордов. ,"Москва, улица Ленинская Слобода, 19с7",55.707796,37.650388,Автозаводская
77019282,Ведущий аналитик качества данных,2023-03-13T16:35:40+0300,https://hh.ru/vacancy/77019282,Москва,,,,"МАГНИТ, Розничная сеть",https://api.hh.ru/employers/49357,"...бизнес-глоссарием, каталогом данным) и качеством данных. Понимание теории баз данных, навыки проектирования схем данных для транзакционных и аналитических систем...","...функционала инструментов (качество данных, бизнес-глоссарий, каталог данных). Реализовывать проверки качества данных, организовывать исправление возникающих инцидентов качества данных. ",,,,
77971296,Data scientist / Дата аналитик / Аналитик массивов данных,2023-03-13T12:49:48+0300,https://hh.ru/vacancy/77971296,Москва,,200000.0,RUR,АЙТИ.СПЕЙС,https://api.hh.ru/employers/2000762,...данных для решения задач промышленного производства. Опыт построения и применения ML-моделей. Опыт работы с библиотеками Python для визуализации данных...,"Поиск, представление, обоснование прямых и косвенных зависимостей, определяющих влияние технологических, организационных и производственных факторов на качество продукции (полуфабрикатов), производительность, издержки...",,,,
78363446,Data engineer,2023-03-21T14:55:51+0300,https://hh.ru/vacancy/78363446,Москва,,,,СБЕР,https://api.hh.ru/employers/3529,Опыт работы с хранилищами данных от 1го года. Опыт работы в роли аналитика с функцией подготовки выгрузки данных для...,...и разработкt витрин и хранилищ данных. Участие в проектировании и реализации инструментов автоматизации разработки. Участие в доработке промышленных витрин данных.,,,,
78102401,"Менеджер по развитию бизнеса / BDM (BI,Data Governance, Data Quality, Big Data,Machine Learning)",2023-03-15T17:08:15+0300,https://hh.ru/vacancy/78102401,Москва,,,,КОРУС Консалтинг,https://api.hh.ru/employers/675,"Погружение"" в бизнес заказчика, готовность ориентироваться в его проблемах и решать их. Для нас важен опыт работы в IT на...",Оформление и согласование договоров с клиентами и внутри компании. Выполнение аналитики продаж (формирование и анализ воронки продаж по ключевым клиентам). ,,,,
78271635,Middle Data Scientist в центр маркетинговой аналитики (Big Data),2023-03-20T12:28:45+0300,https://hh.ru/vacancy/78271635,Москва,,,,МТС,https://api.hh.ru/employers/3776,"...кода (не только встроенные библиотеки). Знание основ математической статистики, дискретной математики. Знание методов визуального представление данных. Опыт работы с маркетологами.","Давать практические рекомендации внутреннему заказчику на основе эконометрических моделей. Искать продуктовые инсайты, основанные на данных. Проводить АВ тесты, решить...","Москва, проспект Андропова, 18к9",55.691684,37.66062,Технопарк
78005939,Инженер данных (Data Engineer),2023-03-14T06:01:23+0300,https://hh.ru/vacancy/78005939,Москва,,,,Siberian Wellness,https://api.hh.ru/employers/51900,...senior data engineer. Опыт работы в связке с аналитиками и data scientists. Опыт построения пайплайнов сбора и обработки данных. ,Проектирование баз данныххранилищ. Построение DWDW+Data Lake. Реализация процессов ETLELT; загрузка данных batchstreaming. Подготовка витрин данных для...,,,,
78083855,Аналитик,2023-03-15T12:33:47+0300,https://hh.ru/vacancy/78083855,Москва,,,,Периодика Пресс,https://api.hh.ru/employers/5472490,...которая развивает data-driven подход в принятии решений. Какие навыки нам важны: Превосходное владение Google Analytics и Data Studio. BigQuery. ,...связную аналитику на основе имеющихся данных. Поддержание данных в актуальном состоянии и недопущение ошибок в GA и дашбордах. Аналитика клиентской...,Москва,55.755864,37.617698,
77736672,WEB-аналитик,2023-03-22T17:03:39+0300,https://hh.ru/vacancy/77736672,Москва,,,,ПИК-специализированный застройщик,https://api.hh.ru/employers/12550,Высшее образование в сфере Экономика  Математика. Опыт работы в B2С и B2B маркетинге от 3 лет. ,"Заниматься сверкой данных: сейчас у нас есть много разных источников данных – TrackAd, CRM, рекламные кабинеты и системы аналитики, важно с...","г.Москва, ул.Баррикадная, д.19 стр.1",0.0,0.0,
76913797,Data-Scientist / Дата-сайентист,2023-03-14T20:56:12+0300,https://hh.ru/vacancy/76913797,Москва,,,,Employcity,https://api.hh.ru/employers/5846248,"Уверенное владение Python. Опыт работы с Data Science библиотеками и фреймворками такими как pandas, sklearn, scipy, matplotlib, catboost и др. ","...методов машинного обучения, имеющихся и необходимых данных. Формирование и проверка гипотез. Извлечение признаков из данных для применения алгоритмов машинного обучения...",,,,
72985700,Старший продуктовый аналитик (AdTech),2023-03-19T08:40:16+0300,https://hh.ru/vacancy/72985700,Москва,,,,VK,https://api.hh.ru/employers/15478,"Беглое владение SQL или его диалектами. Понимание метрик эффективности рекламы. Знание основных продуктовых метрик и понимание того, на какие вопросы...",Настраивать пайплайны для сбора агрегатов и следить за полнотой имеющихся данных. Общаться с различными stakeholder — от разработчиков до продакт-менеджеров...,"Москва, Ленинградский проспект, 39с79",55.796931,37.537847,Аэропорт
73084794,Аналитик (финансовые риски),2023-03-17T13:12:56+0300,https://hh.ru/vacancy/73084794,Москва,,,,Ростелеком,https://api.hh.ru/employers/2748,Желателен опыт работы аналитиком в командах риск-менеджмента портфельной аналитики или предиктивной аналитики (розничныекорпоративные кредитные риски в банках телеком). ,"...источников данных, проектирование витрин данных, генерирование новых атрибутов для data science моделей и аналитики. Интеграция с новыми источниками данных. ",,,,
72312345,Data Engineer,2023-03-15T16:39:52+0300,https://hh.ru/vacancy/72312345,Москва,,400000.0,RUR,Rubbles,https://api.hh.ru/employers/2223982,"Уверенные знания Python 3.7 + Spark 2.4  Spark 3.0 (структуры данных, алгоритмы, концепции языка). Уверенные знания SQL...","Общение с коллегами DQ, выяснение деталей наполенения данных, участие в составлении БТ к данным. Решение неожиданных проблем с данными, задержками...",,,,
78149780,Data engineer (направление предиктивной аналитики),2023-03-16T16:41:28+0300,https://hh.ru/vacancy/78149780,Москва,,,,VK,https://api.hh.ru/employers/15478,"...git, linux, docker — опыт работы с экосистемой Hadoop: HDFS, Spark, Hive. Знания о работе ОС, базовых алгоритмах и структурах данных.","Задачи: Создавать новые надежные и улучшать существующие пайланы, обрабатывающие терабайты данных. Разрабатывать новые витрины данных для аналитики и построения предиктивных...",,,,
77320634,Архитектор модели данных,2023-03-22T11:33:34+0300,https://hh.ru/vacancy/77320634,Москва,,,,Промсвязьбанк,https://api.hh.ru/employers/6591,"...в роли системного аналитикаархитектора данных. Наличие знаний теории построения БД. Наличие знаний в области архитектуры DWH, Data Lake. ",...процессов архитектуры референсных моделей данных и руководства данными. Участие в формировании и развитии концептуальнойфизической моделей данных Единого Хранилища Данных.,"Москва, Большой Спасоглинищевский переулок",55.755788,37.635323,Китай-город
77817314,Product analyst,2023-03-09T11:21:16+0300,https://hh.ru/vacancy/77817314,Москва,,,,Aston,https://api.hh.ru/employers/6093775,"...сбор, хранение, подготовка данных, построение отчетовдашбордов, анализ данных. Уверенное владение SQL и опыт работы с базами данных (Google BigQuery...","Обеспечить регулярный аудит качества и полноты разметки источников трафика, данных о поведении клиентов, а также матчинга онлайн- и офлайн-данных. ",,,,
78067829,Старший аналитик данных в команду маркетинга,2023-03-15T09:20:15+0300,https://hh.ru/vacancy/78067829,Москва,,,,АВИТО ТЕХ,https://api.hh.ru/employers/5779602,"владеете SQL (нужно будет работать с большими массивами данных, уметь писать сложные запросы, оптимизировать их и создавать аналитические витрины данных).","Отдельно ждём от кандидата, что он будет в постоянном поиске улучшения процессов аналитики в команде, а также непрерывном улучшении методологий...",,,,
78056962,Инженер-разработчик Python в группу веб-аналитики,2023-03-14T19:49:02+0300,https://hh.ru/vacancy/78056962,Москва,,,,Rambler&Co,https://api.hh.ru/employers/8620,"Хорошее знание python, понимание solid, аннотаций типов. Работа с библиотеками обработки данных и автоматизации процессов (Pandas, numpy, requests, psychopg, asyncio...","...структуры баз данных, таблиц и скриптов для обработки данных. Выстраивание системы сбора, предобработки и хранения данных веб-аналитики и других...",,,,
78102902,Data Scientist,2023-03-15T17:20:10+0300,https://hh.ru/vacancy/78102902,Москва,,,,"ВСК, САО",https://api.hh.ru/employers/1439,"Знание методов машинного обучения. Опыт обработки больших объемов данных. Знания SQL, Python (уровень не ниже middle), и библиотек для ML...",Полный цикл построения математических моделей от подготовки данных до расчёта финансового результата и подготовки технического задания на внедрение. Подготовка аналитики...,"Москва, Островная улица, 4",,,
78105182,Lead Product Analyst (WMS),2023-03-15T18:20:32+0300,https://hh.ru/vacancy/78105182,Москва,,,,КАЗАНЬЭКСПРЕСС,https://api.hh.ru/employers/3590333,"Скорее всего, у хорошего кандидата найдутся следующие навыки: * Готовность развивать аналитическую инфраструктуру - Airflow, ETL, Data Quaility, Tests & Lineage.","Желание повышать аналитическую культуру в команде, организовывать сбор данных, контролировать соблюдение командой правил корректной оценки успешности инициатив перед раскаткой. * ",,,,
77813590,Data Scientist,2023-03-09T10:47:53+0300,https://hh.ru/vacancy/77813590,Москва,,,,СБЕР,https://api.hh.ru/employers/3529,"Опыт работы со стеком Big Data (GreenPlum, Hadoop) будет плюсом. Крупнейшее DS&AI community - более 1000 DS банка, включая: Регулярный...","...готовности данных. Подтверждение выполнения требований к данным для перехода к созданию модели. Определение требований к перечню, объему и качеству данных...",,,,
78101626,Аналитик,2023-03-15T16:50:57+0300,https://hh.ru/vacancy/78101626,Москва,,,,Фабрика информационных технологий,https://api.hh.ru/employers/726921,"Представление о моделях жизненного цикла программного продукта. Понимание роли аналитика в продуктовой команде. Знание классификации требований, показателей их качества, умение...","Сбор, анализ и документирование требований к ПО. Описание предметной области, бизнес-процессов и проектируемых решений с помощью общепринятых нотаций. ",,,,
77829106,"Системный аналитик (DWH/BI, DG/DQ)",2023-03-09T13:04:33+0300,https://hh.ru/vacancy/77829106,Москва,,,,КОРУС Консалтинг,https://api.hh.ru/employers/675,"Знание принципов разработки ПО, проектирования приложений в части БД (плюсом будет навык работы с системами проектирования логическихфизичеcких моделей данных...","Разрабатывать логические модели данных совместно с архитектором и бизнес-аналитиком. Проводить анализ источников данных, разработку спецификаций на интеграционное взаимодействие. ",,,,
78106749,Аналитик в агентство CRM-маркетинга,2023-03-15T19:42:31+0300,https://hh.ru/vacancy/78106749,Москва,100000.0,160000.0,RUR,Bonfire,https://api.hh.ru/employers/4540735,"Опыт постановки AB тестов на больших базах данных. Знакомство с BigQuery, PowerQuery, Google Tag Manager, Google Analytics, Google Data...","Сбор данных по AB тестам, участие в подготовке отчетов с рекомендациями. Настройка сбора аналитики в Google Analytics. ",,,,
69658696,Data Engineer,2023-03-09T11:48:55+0300,https://hh.ru/vacancy/69658696,Москва,,,,Банк ВТБ (ПАО),https://api.hh.ru/employers/4181,"Уверенные знания основных банковских процессов (достаточно одного): кредитование, процессинг, депозиты; работа системным аналитиком будет преимуществом. Опыт работы в ИТ компаниях...","Построение витрин данных (Hive-SQL, Spark) с погружением в бизнес-процессы и аналитику данных. Уточнение требований заказчика, системный анализ, изучение...",,,,
