id,name,published_at,url,area_name,salary_from,salary_to,salary_currency,employer_name,employer_url,snippet_requirement,snippet_responsibility,address_raw,address_lat,address_lng,address_metro_station_name
78084364,Senior Product Analyst,2023-03-21T08:44:24+0300,https://hh.ru/vacancy/78084364,Москва,,,,VSEMAYKI.RU,https://api.hh.ru/employers/873710,"Понимание различных подходов к архитектуре хранилищ данных и ETLELT-процессов. Опыт построения моделей или каталогов данных, моделей движения данных. ",Лидировать процесс построения системы продуктовой аналитики. Сформировать команду отдела аналитики. Совместно с командой создать модель данных. Написание ТЗ на разметку...,,,,
77504201,Data Analyst,2023-02-28T18:46:57+0300,https://hh.ru/vacancy/77504201,Москва,,,,Альфа-Банк,https://api.hh.ru/employers/80,"Хорошее понимание баз данных SQL и NoSQL. Опыт работы с большими данными: Hadoop, Spark, Kafka. Знание алгоритмов и структур данных. ",...данных. СборФормированиеРазработка витрин. Поиск и анализ несоответствий в данных. Обоснование найденных несоответствий. Формирование предложений по улучшению качества данных. ,,,,
76999676,Аналитик данных,2023-02-27T12:58:44+0300,https://hh.ru/vacancy/76999676,Москва,200000.0,300000.0,RUR,АЙТИ.СПЕЙС,https://api.hh.ru/employers/2000762,"...работы аналитиком данныхсистемным аналитиком в банках, IT компаниях, ритейле от. 3-х лет. Опыт работы в проектах миграции данных. ","...аналитике и разбор на первоисточники, маппинг данных. Потом уже будет перенос данных и разработка. Описание модели данных и полей данных...",,,,
77821721,Middle Data Analyst,2023-03-09T11:56:38+0300,https://hh.ru/vacancy/77821721,Москва,,,,СБЕР,https://api.hh.ru/employers/3529,"Уверенное знание SQL. Опыт в области бизнес-анализа иили построения отчетности. Будет плюсом: Опыт работы c SAS Guide, SAS...","Написание и оптимизация SQL запросов. Подготовка и очистка данных для аналитических задач. Продуктовая и клиентская аналитика, поиск и проверка инсайтов...",,,,
77616544,Data-аналитик,2023-03-02T17:56:00+0300,https://hh.ru/vacancy/77616544,Москва,,,,МТС,https://api.hh.ru/employers/3776,"...и Python обязательно. Знание Excel, PowerQuery на уровне продвинутого пользования. Практический опыт ML-моделирования. Умение анализировать структуру больших массивов данных.","Написание сложных запросов (PostgreSQL). Подготовка данных для анализа: сбор данных, преобразование в удобный для исследования вид и проверка их качества. ",,,,
74006725,Ведущий продуктовый аналитик (B2B),2023-03-21T10:24:23+0300,https://hh.ru/vacancy/74006725,Москва,,,,билайн,https://api.hh.ru/employers/4934,"Мы рассчитываем, что у тебя есть опыт и знания для этой позиции: Опыт работы аналитиком продукта от 3-х лет. ",Формировать ключевые метрики для продуктовой аналитики направления. Проектировать системы событий на основе которых будет стоится аналитика. Изучать пользовательские пути и...,,,,
73296201,Веб-аналитик/аналитик данных,2023-03-12T14:16:36+0300,https://hh.ru/vacancy/73296201,Москва,,,,Инвестиционная компания Фридом Финанс,https://api.hh.ru/employers/577705,"Опыт работы в области хранилищ данных, BI-систем или больших данных. Опыт построения сквозной аналитики. Знания основ моделирования баз данных. ","Делать аналитику клиентской базы, анализировать процессы жизненного цикла клиента, готовить отчеты. Настраивать Post-view аналитику, data – driven моделей атрибуции. ",,,,
76957610,Data Analyst,2023-03-07T11:16:30+0300,https://hh.ru/vacancy/76957610,Москва,,,,Avanta Россия,https://api.hh.ru/employers/89537,"Высшее образование (экономическое или техническое). 0,5-2 года в качестве помощника аналитика, работа с необработанными данными. Навыки работы с...",Загрузка данных в корпоративные IT-системы. Выгрузка данных из в корпоративных IT-систем. Контроль качества и анализ предоставляемых данных в...,,,,
76654306,Data Analyst (Anti-fraud),2023-03-02T14:26:52+0300,https://hh.ru/vacancy/76654306,Москва,,,,СБЕР,https://api.hh.ru/employers/3529,"...знание языков программирования (PL\SQL, Python, R и проч.). Умение работать с большими объёмами данных. Знание методологии по исследованию данных.",Мониторинг и улучшение текущих фрод-правил. Подготовка выгрузок и анализ данных по запросам. Создание и поддержка отчетности. Написание аналитических заключений.,"Москва, Кутузовский проспект, 32к1",55.741338,37.531127,Кутузовская
76045107,"Руководитель продуктовой аналитики в направление ""Работодатели""",2023-03-20T12:09:35+0300,https://hh.ru/vacancy/76045107,Москва,,,,HeadHunter,https://api.hh.ru/employers/1455,"Имеет опыт работы продуктовым аналитиком или аналитиком данных от 2 лет. Отлично знает SQL. Это основной рабочий инструмент аналитика, поэтому...","...продуктового аналитика. У нас классное сообщество сильных аналитиков, где можно обмениваться опытом и совместно инициировать улучшения в процессах аналитики продукта. ","Москва, улица Годовикова, 9с10",55.809343,37.628505,Алексеевская
71260107,Лингвист-аналитик,2023-03-21T18:59:00+0300,https://hh.ru/vacancy/71260107,Москва,95000.0,,RUR,"Megaputer Intelligence, Компания",https://api.hh.ru/employers/191061,"Стажировки, курсы, решение практических задач, связанных с анализом данных. Знание основ корпусной лингвистики, теории вероятности, математической статистики, методов и алгоритмов...","Общение с заказчиком, уточнение деталей проекта. Построение решения на базе внутренних инструментов компании в установленный срок. Командная работа с распределением...",,,,Бауманская
77465870,SENIOR MARKETING ANALYST,2023-03-21T09:42:58+0300,https://hh.ru/vacancy/77465870,Москва,,,,Торговый Дом Кухня без границ,https://api.hh.ru/employers/132015,"5 лет опыта работы в области планирования спроса, прогнозирования продаж или анализа данных в FMCG, кандидаты из других сфер не...",...данных для предоставления рекомендаций отделам маркетинга и продаж для прогнозирования продаж и разработки стратегии. Совершенствование процесса анализа и прогнозирования данных...,"Москва, Верейская улица, 17",55.710631,37.444189,Кунцевская
77673477,Ведущий аналитик / Product Owner,2023-03-22T12:55:13+0300,https://hh.ru/vacancy/77673477,Москва,,,,ics-it,https://api.hh.ru/employers/842621,Опыт разработки и внедрения систем. Опыт анализа бизнес-требований и работы с данными в БД. Ответственность и внимательность. ,Проект создания DataWarehouse в концепции Data Mesh в крупной FMCG компании. Большое количество входящих требований по новым доработкам и улучшениям. ,"Москва, Ярославская улица, 8к6",55.81652,37.649588,ВДНХ
78305728,Руководитель группы аналитики,2023-03-21T08:44:06+0300,https://hh.ru/vacancy/78305728,Москва,,,,VSEMAYKI.RU,https://api.hh.ru/employers/873710,"Понимание различных подходов к архитектуре хранилищ данных и ETLELT-процессов. Опыт построения моделей или каталогов данных, моделей движения данных.",Лидировать процесс построения системы аналитики. Сформировать команду отдела аналитики. Совместно с командой создать модель данных. Написание ТЗ на разметку и...,,,,
78187598,Data QA,2023-03-20T14:41:44+0300,https://hh.ru/vacancy/78187598,Москва,100000.0,,RUR,Перфект Системс,https://api.hh.ru/employers/1713030,"Опыт работы в качестве тестировщикасистемного аналитикаETL разработчика на проектах создания аналитических платформ данных (DWH, Data Lake и пр.). ","Тестирование ETL, написание и поддержка SQL-скриптов для проверки данных. Проведения функциональных тестирования web-приложений и сервисов, по завершению различных...",,,,
77994104,Web-аналитик,2023-03-21T13:34:13+0300,https://hh.ru/vacancy/77994104,Москва,,,,Абсолют Страхование,https://api.hh.ru/employers/4431705,"Опыт настройки сквозной аналитики Data studio, Owox, BI. Опыт разработки архитектуры сайта. Понимание процессов project-менеджмента. Анализ данных и предоставление...","Участие в проектах компании, анализ, презентации. Доработка стандартных отчетов в системах аналитики и разработка новых типов отчетов. Подготовка отчетов, регулярные...","Москва, улица Ленинская Слобода, 26с4",55.710215,37.652795,Автозаводская
77959096,Data Engineer,2023-03-22T10:53:23+0300,https://hh.ru/vacancy/77959096,Москва,,,,Датаномика,https://api.hh.ru/employers/4913210,Умение оптимизировать запросы для работы с большими объемами данных в СУБД ORACLE и PostgreSQL. Опыт работы с брокером сообщений Apache...,"Разработкой баз данных (Oracle, PostgreSQL, ClickHouse, Cassandra). Разработкой потоков данных, подключаемых к платформе от внешних команд. Разработкой потоков данных для...","Москва, Кутузовский проспект, 32",55.740426,37.532071,Кутузовская
78301142,Старший Аналитик (E-commerce),2023-03-20T17:21:32+0300,https://hh.ru/vacancy/78301142,Москва,,,,METRO Cash & Carry,https://api.hh.ru/employers/673,"Имеете опыт подготовки аналитики для бизнес-заказчиков с использованием моделирования данных, создание прогнозных моделей временных рядов. Умеете в краткие сроки...","Отслеживать динамику ключевых метрик, улучшать продуктовое прогнозирование в различных срезах (товарные группы, промо, магазины, регионы, площадки, др.). На основе данных...","Москва, Ленинградское шоссе, 71Г",55.875753,37.447279,Беломорская
68345490,Продуктовый аналитик (compliance),2023-03-20T09:38:25+0300,https://hh.ru/vacancy/68345490,Москва,,,,Тинькофф,https://api.hh.ru/employers/78638,"Опыт в построении информативных визуализаций данных в системах визуализации (Tableau, Grafana). Хорошее знание принципов работы реляционных баз данных и владение...",Выступать партнером продуктовых команд при принятии решений на основе данных. Принимать участие в формировании и приоритизации продуктовых планов на основе...,"Москва, Головинское шоссе, 5",55.84024,37.492024,Водный стадион
78259005,Риск-аналитик,2023-03-20T10:20:54+0300,https://hh.ru/vacancy/78259005,Москва,,,,IDF Eurasia,https://api.hh.ru/employers/1191643,Опыт работы с BI инструментами минимум 2 года. Должность аналитика в финансовой сфере не менее 2 лет. Опыт построения скоринговых...,"Статистический анализ риск-метрик (уровень одобрения, уровень просрочки, etc.) и комплекса мер, принимаемых в случае выхода KPI из заранее оговорённых...","Москва, улица Василисы Кожиной, 1",55.737502,37.504789,
78270914,Старший эконометрист в центр маркетинговой аналитики (Big Data),2023-03-20T12:21:56+0300,https://hh.ru/vacancy/78270914,Москва,,,,МТС,https://api.hh.ru/employers/3776,"...визуального представление данных. Аналитические способности. Способность видеть и выделять неочевидное, ставить гипотезы и находить и объяснять зависимости в данных. ","Разрабатывать эконометрические модели для описания и прогнозирования бизнес и маркетинговых KPIs бренда, оценивать работу маркетингового микса и прогнозирования. ","Москва, проспект Андропова, 18к9",55.691684,37.66062,Технопарк
78391528,Data engineer (Беспилотные автомобили),2023-03-22T10:30:07+0300,https://hh.ru/vacancy/78391528,Москва,,,,Яндекс,https://api.hh.ru/employers/1740,"Уверенно знаете SQL, понимаете принципы построения моделей хранения и обработки данных. Знаете инструменты оркестрации ETL-пайплайнов (Airflow или аналоги). ","...петабайты данных. Ищем специалистов, которые помогут решать задачи по анализу данных. Что нужно делать: Проектировать и создавать витрины данных по...",,,,
77426640,Tech Lead Data Engineer,2023-03-20T12:56:25+0300,https://hh.ru/vacancy/77426640,Москва,,,,Платформа ОФД,https://api.hh.ru/employers/3536900,"Аналогичный опыт работы от 3-х лет, обязателен опыт управления командой. Имеешь опыт управления командой. Пишешь на Scala, Python SQL. ","Управлять командой, состоящей из 4 Data Engineers. Оптимизировать инфраструктуру и внутренние сервисы по обработке больших данных. Разрабатывать ETL-процессы с...","Москва, Усачёва улица, 33с1",55.723207,37.561113,Лужники
76599121,Data architect / Архитектор данных,2023-03-22T17:07:01+0300,https://hh.ru/vacancy/76599121,Москва,,,,Группа Самолет,https://api.hh.ru/employers/1102601,"Глубокие знания принципов интеграции данных (ETLELT). Опыт работы со стэком Big Data (Hadoop, Spark, Hive, Kafka и пр). ",Формирование и согласование планов работ по развитию методологий и систем обработки данных. Формирование текущих статусов и проблем в архитектуре данных...,,,,
78042103,"Senior Data Scientist, Анализ текста (DS/NLP)",2023-03-22T12:24:40+0300,https://hh.ru/vacancy/78042103,Москва,,,,WILDBERRIES,https://api.hh.ru/employers/87021,"Знание Python (интерес к Go приветствуется, но не обязателен). Понимание алгоритмов и структур данных. Желание заниматься аналитикой, ML и NLP...",Команда относится к «Управлению машинного интеллекта и исследований» WB. От нее напрямую зависит качество поисковой выдачи. Ребята совершенствуют алгоритмы распознавания...,,,,
76165484,Data Scientist,2023-03-20T11:24:29+0300,https://hh.ru/vacancy/76165484,Москва,,,,Детский Мир,https://api.hh.ru/employers/4880,"Наличие успешно завершенных проектов с использованием технологий анализа данных и машинного обучения. Знание моделей машинного обучения, принципов их работы, методов...",Поиск новых возможностей реализации персонализации промо-кампаний в данных. Проведение АB тестов и проверка эффекта для подтверждения коммерческой эффективности...,"Москва, 3-й Нижнелихоборский проезд, 3с6",55.846745,37.563808,Окружная
67449833,Веб-аналитик,2023-03-20T09:44:44+0300,https://hh.ru/vacancy/67449833,Москва,,,,Детский Мир,https://api.hh.ru/employers/4880,"Опыт работы в e-commerce проектах. Знание ключевых маркетинговых и продуктовых метрик. Владение методами сегментации пользовательской базы, факторного, регрессионного и...","Атрибуционное моделирование. Исследование данных для выявления проблем, закономерностей, аномалий. Автоматизация отчётности, создание дашбордов (Tableau, Google Data Studio). Анализ и прогнозирование...","Москва, 3-й Нижнелихоборский проезд, 3с6",55.846745,37.563808,Окружная
78299931,Системный аналитик (IBP),2023-03-20T17:03:26+0300,https://hh.ru/vacancy/78299931,Москва,230000.0,,RUR,Rubbles,https://api.hh.ru/employers/2223982,...ответственность и инициативность. Высшее техническое образование (желательно в сфере информационных технологий). Знакомство с Python. Знакомство с инструментами анализа Big Data.,Формирование технической документации . Поиск источников требуемых данных в DWH заказчика. Формирование компонентно-интеграционных схем совместно с архитектором. Постановка задач на...,"Москва, проспект Мира, 3с3",55.773444,37.63164,
78075638,Инженер данных (PostgreSQL),2023-03-21T10:58:11+0300,https://hh.ru/vacancy/78075638,Москва,,,,билайн,https://api.hh.ru/employers/4934,"Опыт разработки ETL процессов, Hadoop. Опыт потоковой разработки конвейеров данных в NiFi или Flink. Опыт разработки БД, автоматизации и оптимизации...",Проектирование и разработка хранилища метрик в БД аналитической системы (Postgres). Разработка ETL-потоков Python + Airflow. Разработка алгоритмов расчёта метрик. ,,,,
73565503,Старший Антифрод-аналитик (Remote),2023-03-20T15:44:25+0300,https://hh.ru/vacancy/73565503,Москва,,,,РобоФинанс,https://api.hh.ru/employers/2716012,"Практический опыт использования Pandas в задачах анализа данных - от 3х лет. Знания в Data Science, умение строить модели, в...","Ворочать данные, находить новые закономерности, позволяющие маркировать мошеннические заявки в потоке заявок на получение займа (60% времени). Заниматься построением моделей...",,,,
78422892,Дата архитектор - Data architect,2023-03-22T18:05:32+0300,https://hh.ru/vacancy/78422892,Москва,160000.0,190000.0,RUR,7RedLines,https://api.hh.ru/employers/2661230,Понимание бизнес-процессов в CPGFMCG-компаниях. Желателен опыт участия в роли аналитикастрим лида в проектах по построению систем...,...том числе требований к отчетности и хранилищу данных. Формировать критерии выбора хранилища данных и системы отчетности и выполнять оценку на...,,,,
78328885,Digital-аналитик,2023-03-21T09:04:46+0300,https://hh.ru/vacancy/78328885,Москва,,90000.0,RUR,Росгосцирк ФКП,https://api.hh.ru/employers/661788,"...инструментов бизнес-аналитики, таких как Tableau, Power BI, Google Data Studio и др. Опыт работы с большими объемами данных, умение...","Веб-аналитика: Google Analytics (Universal, GA-4), Яндекс.Метрика, Битрикс24. Сбор и анализ данных. Отчётность. Медиапланирование: SEO, медийная и контекстная...","Москва, Пушечная улица, 4с1",55.760601,37.622369,
