id,name,published_at,url,area_name,salary_from,salary_to,salary_currency,employer_name,employer_url,snippet_requirement,snippet_responsibility,address_raw,address_lat,address_lng,address_metro_station_name
78365282,Системный аналитик (скрипты),2023-03-21T15:25:46+0300,https://hh.ru/vacancy/78365282,Москва,,,,SILA Union,https://api.hh.ru/employers/5318263,Имеете опыт разработки нормативной или проектной документации. Имеете опыт работы со скриптами в ARIS или SILA Union или Business Studio...,"Написание требований к скриптам SILA Union по внутренним потребностям компании. Участие в проектах внедрения ПО, написание требований к скриптам по...",,,,
76090235,Старший системный аналитик (удаленно),2023-03-21T13:17:27+0300,https://hh.ru/vacancy/76090235,Москва,,,,"Лента, федеральная розничная сеть",https://api.hh.ru/employers/7172,"Знание методов графического описания процессов и умение читать схемы (блок-схемы, BPMN, UML-диаграммы и его самые распространенные виды: use...","Выделять бизнес-сущности, определять связи и ограничения. Моделировать данные - раскладывать сущности по таблицам. Формировать требования к таблицам: ключи, партиции, условия...",,,,
76396688,Mid/Mid+ Data Scientist (NLP),2023-03-21T18:27:05+0300,https://hh.ru/vacancy/76396688,Москва,180000.0,240000.0,RUR,Платформа ОФД,https://api.hh.ru/employers/3536900,"...анализа данных. Знание библиотек Pandas, NumPy, SсiPy, scikit-learn, TensorFlowKerasPyTorch и т.д. Опыт работы с базами данных. ",Разрабатывать алгоритмы и модели для решения задач анализа данных о продажах товаров и услуг на всей территории России. ,"Москва, Усачёва улица, 33с1",55.723207,37.561113,Лужники
77734409,Специалист по защите данных/Data Protection Officer в Яндекс Go,2023-03-21T17:23:10+0300,https://hh.ru/vacancy/77734409,Москва,,,,Яндекс,https://api.hh.ru/employers/1740,Хотите глубоко погружаться в процессы работы с данными. Участвовали в крупных инфраструктурных проектах. Понимаете GDPR. Знаете английский.,"Повышать осведомлённость сотрудников. Придумывать новые технические подходы к защите данных, внедрять их вместе с командами разработки. Развивать и поддерживать процессы...",,,,
78045387,Руководитель группы аналитиков качества данных,2023-03-20T15:21:52+0300,https://hh.ru/vacancy/78045387,Москва,,,,билайн,https://api.hh.ru/employers/4934,...качества данных в группе управления данными предприятия или управления данными от 3 лет. Опыт работы руководителем группы аналитиков качества данных...,"...ценностью данных. Определение первопричины проблем с качеством данных и работа с заинтересованными сторонами: Владельцами доменов данных, Владельцами продуктов данных, Стюардами...",,,,
78409448,Игровой аналитик (продуктовый аналитик),2023-03-22T14:25:03+0300,https://hh.ru/vacancy/78409448,Москва,,,,Zebomba Games,https://api.hh.ru/employers/4060167,"Знание языков программирования для аналитики: SQL, DAX R Python. Опыт работы с одной из аналитических системами данных (PowerBI, Tableau). ","Сбор, обработка и анализ данных, предоставление аналитических выводов. Подготовка и проведение AB - тестов; - Мониторинг ключевых игровых метрик. ","Петрозаводск, Красная улица, 10",61.790946,34.358143,
69774676,Data scientist,2023-03-21T12:11:53+0300,https://hh.ru/vacancy/69774676,Москва,,,,VK,https://api.hh.ru/employers/15478,Обладаешь уверенными навыками программирования на Python и хотя бы в одном статически типизированном языке. Имеешь опыт с DL библиотеками (Pytorch...,"Исследование поведенческих паттернов и нахождение зависимостей в данных используя статистические методы анализа. Проведение аналитики табличных данных, временных рядов.",,,,
77723447,Маркетинговый аналитик / аналитик продаж,2023-03-21T14:29:52+0300,https://hh.ru/vacancy/77723447,Москва,100000.0,155000.0,RUR,NEOCLASSICA,https://api.hh.ru/employers/4813575,"Знание современных методов статистического анализа, обработки данных, методологии количественных и качественных исследований, построения прогнозных моделей, постановки гипотез и интерпретации полученных...","Анализ статистической информации, баз данных, Метрики, Google Analytics. Визуализация отчетности. Прогноз, анализ и отчетность по проводимым РК. Регулярный анализ динамики...","Москва, Большой Афанасьевский переулок, 28",55.749587,37.597782,
78304384,System analyst DWH,2023-03-20T18:17:44+0300,https://hh.ru/vacancy/78304384,Москва,,,,Lamoda Tech,https://api.hh.ru/employers/9418714,"Опыт работы на позиции системного аналитика DWH от 1 года. Опыт работы с СУБД enterprise уровня (Oracle, SQL Server). ",Работать с корпоративным хранилищем данных (DWH). Собирать и формализировать требования заказчиков на разработку нового функционала. Предоставлять выгрузки данных из DWH...,,,,
77889652,Разработчик,2023-03-22T12:49:05+0300,https://hh.ru/vacancy/77889652,Москва,,,,Гридфор,https://api.hh.ru/employers/3932856,Опыт участия в разработке хранилищ данных не менее 1 года. Знание SQL. Знание Python. Опыт работы с Git. ,"Оптимизация SQL запросов, потоков загрузки данных. Проектирование потоков данных. Проектирование и разработка процессов преобразования данных (ETL) для хранилища данных.",,,,
77666231,Senior CRM analyst,2023-03-03T19:19:16+0300,https://hh.ru/vacancy/77666231,Москва,130000.0,150000.0,RUR,Team4You,https://api.hh.ru/employers/5050303,"Excel на продвинутом уровне. Большой опыт визуализации данных (Power BI, Data Lens, Tableau, Excel и тд). Уверенное знание SQL. ","Разработка и внедрение стратегий CRM-маркетинга. Обогащение клиентских данных, аналитика и сегментация. Планирование и реализация коммуникационных кампаний в каналах email...",,,,
78314649,Аналитик по качеству данных,2023-03-20T23:08:33+0300,https://hh.ru/vacancy/78314649,Москва,,,,СБЕР,https://api.hh.ru/employers/3529,Знания и опыт в практической реализации контроля качества данных. - Базовое понимание архитектуры хранилищ данных. - Знание SQL. Плюсом будет опыт работы...,"...данных по витринам. - Взаимодействие с владельцами источников и потребителями данных, идентификация и отработка инцидентов. - Формирование требований по процессам поставки данных...",,,,
77435865,Старший бизнес/системный аналитик (Big Data),2023-03-20T14:55:15+0300,https://hh.ru/vacancy/77435865,Москва,,,,"Лента, федеральная розничная сеть",https://api.hh.ru/employers/7172,"Опыт моделирования рабочих процессов и данных, проектирования систем и написания спецификаций. Опыт проектирования веб-сервисов, баз данных, API, пользовательских интерфейсов. ","Выявление, управление и поддержка бизнес, функциональных и нефункциональных требований. Разработка артефактов анализа: vision, use cases, функциональных спецификаций ПО, диаграмм и...",,,,
78274270,Ведущий аналитик,2023-03-20T12:54:54+0300,https://hh.ru/vacancy/78274270,Москва,,,,USETECH,https://api.hh.ru/employers/681672,"...области построения баз данных, обработки больших данных (BigData). Опыт использования RedmineConfluence. БигДата, ИИ, Greenplum, NiFi, PgSQL, AirFlow, Data Vault.","Формирование аудиторий для информационных кампаний. Предоставление аналитики на основе этих данных, в том числе по требованию. Поставщик данных для внутренних...",,,,
77896761,Разработчик систем бизнес-аналитики,2023-03-22T13:39:02+0300,https://hh.ru/vacancy/77896761,Москва,110000.0,,RUR,Увелка ООО «Ресурс»,https://api.hh.ru/employers/94470,"...данных (хранилищ данных), оптимизации запросов. Опыт работы с 1С (организация автоматической загрузки данных из учетной системы в хранилище данных).",...1С) и пр.) и обработки данных. Формулирование и реализация предложений по источникам данных для целей отчетности в системе BI...,"Москва, улица Сергея Макеева, 13",55.763346,37.551241,Улица 1905 года
78000382,Бизнес-аналитик сегмента B2G,2023-03-19T19:53:08+0300,https://hh.ru/vacancy/78000382,Москва,,,,билайн,https://api.hh.ru/employers/4934,"Опыт работы в должности аналитика в сферах телекомасистемной интеграцииIT. Знание Excel (ВПР, макросы, сводная таблица) обязательно. ",Создание и автоматизация всей аналитики для сегмента B2G. Прогнозирование всех трендов сегмента по каждому региону и формирование направлений...,,,,
78330086,Data scientist,2023-03-21T09:22:51+0300,https://hh.ru/vacancy/78330086,Москва,,,,ЛОКО-БАНК,https://api.hh.ru/employers/1149,"Базовый математический бэкграунд (теория вероятностей, математическая статистика). Базовые знания Python (обработка данных с помощью pandas, NumPy). Базовые знания процесса кредитования...","Формирование и сопровождение витрин данных для целей моделирования, прогнозирования и data-аналитики. Статистический анализ факторов риска. Расширение, автоматизация и систематизация...","Москва, Ленинградский проспект, 39с80",55.796562,37.536922,Аэропорт
77412327,Web-аналитик,2023-03-20T10:17:24+0300,https://hh.ru/vacancy/77412327,Москва,120000.0,,RUR,Мир Крепежа ТД,https://api.hh.ru/employers/854270,"...визуализации аналитических данных (Google Data Studio, Yandex data Lens, Power BI, Tablue и др.). Понимаешь как устроены базы данных, уверенно...","Настройка и мониторинг корректного сбора данных системами аналитики. Подготовка ТЗ для разработчиков и проверка реализации, тестирование. Разработка и предложение планов...","Москва, Головинское шоссе, 5А",55.839855,37.490263,Водный стадион
74257288,Data аналитик (Рекламная платформа),2023-03-20T10:17:20+0300,https://hh.ru/vacancy/74257288,Москва,,,,СБЕР,https://api.hh.ru/employers/3529,"Уверенная работа с Python. Опыт аналитики с использованием инструментов Spark Streaming, Hbase, Spark, Kafka, Hive, Impala, Hue и т.д. ","Проведение ad-hoc аналитики на данных рекламы (Hive, Spark, SQL). Визуализация отчетности в BI инструментах (SuperSet, Qlik). Работа с алгоритмами...",,,,
77316163,Data Scientist (DMAG),2023-03-22T11:08:48+0300,https://hh.ru/vacancy/77316163,Москва,,,,Лаборатория Касперского,https://api.hh.ru/employers/1057,"Хорошее знание моделей машинного обучения и понимания их внутренностей (например, зачем нужен градиент в градиентном бустинге). Уверенные навыки в python. ","Анализ androidmac файлов. Распознавание вредоносных интернет ресурсов основываясь на статистических данных, графах связей IP адресов. Кластеризация, быстрый поиск похожих...",,,,
78183827,Аналитик,2023-03-20T13:44:53+0300,https://hh.ru/vacancy/78183827,Москва,,,,fäm Properties,https://api.hh.ru/employers/9569257,"Умные готовить аналитические справки. Умение провести ресерч, если внутренних данных недостаточно. Уметь делать красивые и лаконичные презентации с цифрами. ","Инвестиционный консалтинг. Покупка, продажа, аренда недвижимости. Управление недвижимостью. Строительство недвижимости. Инженерная инспекция и прием недвижимости. Юридическое сопровождение. Оформление резиденства. ",,,,
78265110,Senior Data Scientist,2023-03-20T11:20:59+0300,https://hh.ru/vacancy/78265110,Москва,300000.0,,RUR,Сеть Партнерств,https://api.hh.ru/employers/5290101,Опыт работы с Git. Аккаунт с работами на Kaggle. Опыт построения витрин данных. Опыт работы с Docker. Опыт c AutoML.,"Осуществлять техническое руководство DS командой: заниматься выстраиванием технологических процессов, unit-тестирование, code-review, сборка, ведение документации, изучать SoTA фреймворки и...",,,,
77842946,Data Researcher/ Лидогенератор,2023-03-21T15:44:55+0300,https://hh.ru/vacancy/77842946,Москва,50000.0,90000.0,RUR,MVP Lab,https://api.hh.ru/employers/4677188,"Английский не ниже уровня Intermediate. Положительный опыт работы в IT компании на схожей позиции. Владение инструментами Linkedin Sales Navigator, Apollo...","Чистка, проверка и валидация собранных данных. Загрузка базы в CRM систему и outreach-каналы. Участие в написании цепочки сообщений, в...",,,,
78273747,Data Engineer (Big Data),2023-03-20T12:48:38+0300,https://hh.ru/vacancy/78273747,Москва,,,,Платформа ОФД,https://api.hh.ru/employers/3536900,"Не менее 2-х лет решаешь задачи в области сбора, хранения и анализа данных. Пишешь код на Scala. ","Анализировать, проектировать и создавать витрины данных в соответствии с требованиями конкретного проекта. Развивать инфраструктуру для обработки больших данных и кодовой...",,,,
77181469,Data scientist / Аналитик риск-моделей,2023-03-20T15:50:49+0300,https://hh.ru/vacancy/77181469,Москва,120000.0,300000.0,RUR,МФК ВЭББАНКИР,https://api.hh.ru/employers/1213725,"Высшее математическое или техническое образование (предпочтительно: МГУ, МФТИ, МФТИ, МГТУ им. Баумана). Опыт построения моделей от 2-х лет. ",Построение вероятностных скоринговых моделей. Анализ имеющихся и новых источников данных и эффективное использование их для процесса принятия решений. ,"Москва, МКАД, 69-й километр, внешняя сторона, к1",55.865904,37.399713,Сходненская
72468671,Аналитик Глоссария Банка,2023-03-16T16:15:25+0300,https://hh.ru/vacancy/72468671,Москва,,,,Газпромбанк,https://api.hh.ru/employers/3388,"...моделей данных (ER-модели) на основе бизнес требований, проектирования баз данных, построения диаграмм моделей. Знание инструмента проектирования моделей данных (SAP...","...Моделей данных, разрабатываемых проектами. Анализ проектной документации с целью ограничения состава понятий Глоссария конкретного проекта, потоков и состава данных. ",,,,
78086889,Ведущий риск - аналитик (data science/machine learning),2023-03-21T13:16:49+0300,https://hh.ru/vacancy/78086889,Москва,,,,Микрокредитная Компания Кредито24,https://api.hh.ru/employers/1745319,"Высшее техническое образование (предпочтительно МГУ, МФТИ, ВШЭ, СПБгУ). Отличные знания математической статистики и теории вероятностей. Знание алгоритмов и теоретических основ...","Построение скоринговых моделей (application, fraud, behavioral, collection, response, propensity). Анализ дополнительных источников данных для включения в скоринговые модели. ","Москва, Краснопролетарская улица, 16с1",55.77757664119386,37.607117668647405,
77056705,Аналитик - математик,2023-03-18T09:52:31+0300,https://hh.ru/vacancy/77056705,Москва,,,,Altenar,https://api.hh.ru/employers/976061,"Базовые знания SQL, опыт работы с базами данных. Опыт работы в букмекерской сфере  готовность быстро изучить рынок букмекерского продукта. ",Разработка математических моделей для различных видов спорта. Описание моделей и составление технической документации. Проверка гипотез и поиск оптимальных решений в...,,,,
78373823,Data scientist,2023-03-21T17:52:08+0300,https://hh.ru/vacancy/78373823,Москва,,,,Банки.ру,https://api.hh.ru/employers/72986,"Знание классических алгоритмов и структур данных. Хорошая математическая подготовка. Знание границ применимости алгоритмов и метрик, умение выбрать подходящие под задачу. ","Сбор данных, выбор модели, тестирование, внедрение. Построение алгоритмов Next Best Action, Uplift. Исследование данных (ad-hoc аналитика, сегментациякластеризация). ","Москва, Одесская улица, 2кА",55.664472,37.599238,Нахимовский проспект
71324858,Middle/Senior Продуктовый аналитик в направление работодатели,2023-03-22T12:30:19+0300,https://hh.ru/vacancy/71324858,Москва,,,,HeadHunter,https://api.hh.ru/employers/1455,"Имеет опыт работы продуктовым аналитиком или аналитиком данных от 2 лет. Отлично знает SQL. Это основной рабочий инструмент аналитика, поэтому...","Развивать дашборды, позволяющие отвечать на вопросы о том, что происходит с продуктом. Проводить adhoc анализ данных о поведении пользователей.","Москва, улица Годовикова, 9с10",55.809343,37.628505,Алексеевская
77812459,Старший разработчик Qlik Sense,2023-03-21T10:38:08+0300,https://hh.ru/vacancy/77812459,Москва,,,,билайн,https://api.hh.ru/employers/4934,"...не менее 2 лет в области построения системы аналитики и витрин данных. Знание технических систем  ИТ-продуктов: QlikSence, QlikView, Microsoft...","...системы аналитики и витрин данных. Разработка аналитических моделей и приложений в QlikSense. Создание структуры данных и метрик, проектирование моделей данных...",,,,
54848793,Разработчик BI,2023-03-22T13:53:26+0300,https://hh.ru/vacancy/54848793,Москва,,,,"Телеканал Россия, ГТК",https://api.hh.ru/employers/27989,"Знания MS SQL Server, SSIS, SSAS, SSRS. Работа с Visual Studio. Опыт работы с системами контроля версий. Опыт командной разработки. ",Разработка хранилищ данных. Создание ETL решений. Разработка алгоритмов обработки данных. Создание моделей SSAS Tabular. Подготовка данных для интерактивных визуализаций для...,"Москва, 5-я улица Ямского Поля",55.787153,37.580544,Белорусская
