id,name,published_at,url,area_name,salary_from,salary_to,salary_currency,employer_name,employer_url,snippet_requirement,snippet_responsibility,address_raw,address_lat,address_lng,address_metro_station_name
78191386,Менеджер по закупкам со знанием английского языка,2023-03-17T17:02:12+0300,https://hh.ru/vacancy/78191386,Москва,200000.0,,RUR,ВсеИнструменты.ру,https://api.hh.ru/employers/208707,"2. Умение формировать эффективные и долгосрочные партнерские взаимоотношения. 3. Базовая аналитика, широкий бизнес-кругозор. 4. Стратегическое мышление. Ориентация на результат. ","1. Поиск поставщиков по своим брендам в Европе, Турции, ОАЭ и тп. 2. Получение новых условий, договоренности об отсрочке. 3. ","Москва, Волгоградский проспект, 42к8",55.710905,37.71936,Текстильщики
78148984,Data Engineer (Apache NiFi),2023-03-16T16:23:30+0300,https://hh.ru/vacancy/78148984,Москва,,,,ПИК-специализированный застройщик,https://api.hh.ru/employers/12550,Опыт работы c ETL (NIFI или Informatica или Airflow или Spoon или другие). Знание и навыки использования следующих процессоров: Execute...,"...и записи данных. Разрабатывать и конфигурировать элементы данных из СУБД,REST, ESB,S3. Разрабатывать маппинг и преобразование данных к...",,,,
78147920,Инженер данных (Data Office),2023-03-16T16:02:47+0300,https://hh.ru/vacancy/78147920,Москва,,,,"СИБУР, Группа компаний",https://api.hh.ru/employers/3809,"Знания алгоритмов в сфере высоконагруженной обработки данных при помощи распределённых вычислений (MR). Умение работать с Avro, Parquet форматом данных (типы...","Разработкой и оптимизацией алгоритмов операционного анализа данных. Развитием практик DevSecOps, автомтизацией миграций и разработческих пайплайнов. Взаимодействием с аналитиками данных (data...","Москва, Кржижановского",55.680691,37.568273,Профсоюзная
77326234,Senior DevOps Engineer/SRE (BigData),2023-02-22T13:14:02+0300,https://hh.ru/vacancy/77326234,Москва,,,,ЦРПТ (Центр развития перспективных технологий),https://api.hh.ru/employers/3156389,Навыки администрирования ОС семейства Linux. Понимание основ построения масштабируемых отказоустойчивых систем и приложений. Опыт работы с технологиями Hadoop (HDFSHBase...,Поддержка процесса непрерывной интеграцииразвертывания сервисов в области аналитики больших данных (сборкатестированиеразвертывание). Поддержка инструментов  фреймворков для автоматизации тестирования...,,,,
75706286,Team Lead Backend (PHP),2023-03-17T09:17:18+0300,https://hh.ru/vacancy/75706286,Москва,300000.0,550000.0,RUR,EGGHEADS,https://api.hh.ru/employers/4562440,Самостоятельно программировать. За базу знаний Backend’а. У тебя есть опыт от 3 лет в роли разработчика PHP на любом...,"Мы ищем сильного Backend Lead на решения, связанные с аналитикой конкурентов, категорийным анализом, поиском ниши на маркетплейсах, а также системы...",,,,
73527245,Dev Lead Backend (PHP),2023-03-17T09:17:18+0300,https://hh.ru/vacancy/73527245,Москва,300000.0,550000.0,RUR,EGGHEADS,https://api.hh.ru/employers/4562440,Самостоятельно программировать. За базу знаний Backend’а. У тебя есть опыт от 3 лет в роли разработчика PHP на любом...,"Мы ищем сильного Backend Lead на решения, связанные с аналитикой конкурентов, категорийным анализом, поиском ниши на маркетплейсах, а также системы...",,,,
78156225,Аналитик группы поддержки продаж,2023-03-16T20:57:01+0300,https://hh.ru/vacancy/78156225,Москва,,,,"Иннотех, Группа компаний",https://api.hh.ru/employers/4649269,Опыт работы в области Data ScienceML. Понимание принципов применения ЖЦ данных и мат. моделей. Навыки планирования и оценки трудоемкости...,"Работа над прототипом в роли системного аналитикаразработчика. Подготовка проектной документации (функциональные требования, технические задания и решения, спецификации, инструкции и...",,,,
78178099,Руководитель отдела маркетинга,2023-03-17T12:21:21+0300,https://hh.ru/vacancy/78178099,Москва,,,,CREDIX,https://api.hh.ru/employers/3855897,"Опыт работы с Power BI, google data studio и bitrix24 будет вашим преимуществом. Активная жизненная и профессиональная позиция, высокий...","Управление комплексом маркетинга на основе данных — продвинутая аналитика. Управление отделом маркетинга — постановка планов, задач, контроль исполнение, обучение сотрудников. ",,,,
73869362,Младший web-аналитик,2023-03-16T14:43:42+0300,https://hh.ru/vacancy/73869362,Москва,,,,i-Media,https://api.hh.ru/employers/87968,"Опыт программирования - плюс (JavaScript, R или Python - большой плюс). Опыт работы с базами данных - плюс. Знание английского языка приветствуется. ","Разработка bi-отчетности в Microsoft Power BI, Google Data Studio и аналогичных инструментах. В дальнейшем - самостоятельное управление проектами по аналитике...","Москва, Электрозаводская улица, 24",55.78895,37.707727,
71807760,Аналитик CRM,2023-03-16T12:14:47+0300,https://hh.ru/vacancy/71807760,Москва,,,,ОКЕЙ – Федеральная розничная сеть,https://api.hh.ru/employers/1276,"Знание Excel - продвинутый пользователь (макросы, формулы, диаграммы). Опыт построения аналитики на транзакционных данных (клиентская статистика). Опыт анализа клиентского поведения. ",Формирование сегментационных моделей. Разработка алгоритма расчета персональных предложений и анализа результатов. Разработка и внедрение методологий анализа клиентского поведения. ,"Москва, Кировоградская улица, 23Ак1",55.60012,37.600873,Улица Академика Янгеля
78141200,Финансовый аналитик,2023-03-16T14:23:05+0300,https://hh.ru/vacancy/78141200,Москва,,,,QIWI,https://api.hh.ru/employers/3125,"Если ты знаком с Python для анализа данных( Pandas, NumPy). Умеешь писать SQL запросы к базам данных. Имеешь опыт работ...",...на основе собираемых данных. Проводить оценку эффективности реализованных проектов и разрабатывать системы мониторинга. Делать Ad-hoc аналитику для выявления точек...,,,,
78152796,Ведущий специалист по маркетинговым исследованиям,2023-03-16T17:40:48+0300,https://hh.ru/vacancy/78152796,Москва,,,,Компания БКС,https://api.hh.ru/employers/1833,"Как преимущество опыт работы в IBM SPSS Data Collection. Как преимущество знание статистических методов обработки данных (корреляционно-регрессионный анализ, кластерный...","Участвовать в подготовке аналитики по рынку инвестиций, desk-research, конкурентному анализу. Взаимодействовать с внутренними бизнес-заказчиками по вопросам проведения исследований. ","Москва, Калужско-Рижская линия",55.781757,37.633482,Проспект Мира
78120333,"Data Scientist, Товарные рекомендации",2023-03-16T09:57:20+0300,https://hh.ru/vacancy/78120333,Москва,,,,Ozon,https://api.hh.ru/employers/2180,"Писать runtime движок на Golang. Хорошее знание Python и Golang, или иметь желание быстро их изучить. Понимание алгоритмов ML. ",,"Москва, Пресненская набережная, 10",55.74723295660558,37.536558290665916,Деловой центр
78120264,"Аналитик-разработчик SQL, удаленно",2023-03-16T09:56:25+0300,https://hh.ru/vacancy/78120264,Москва,,,,РОСБАНК,https://api.hh.ru/employers/599,"Опыт работы в банковской сфере, понимание банковской тематики. Опыт работы с GreenPlum, PostgreSQL (возможно T-SQL или PLSQL) от...",Разработка витрин уровня DM (Data Marts) в корпоративном хранилище банка. Разработка и поддержка мотивационнойуправленческойоперативной отчётности. Аналитические исследования данных.,,,,
74015919,Руководитель направления по загрузке данных в БКИ,2023-03-16T15:22:49+0300,https://hh.ru/vacancy/74015919,Москва,,,,Мокка,https://api.hh.ru/employers/1220357,Продвинутый пользователь Credit Registry. Навыки написания хранимых процедур. JiraConfluence. Знание и опыт работы с гибкой методологией разработки Agile Scrum...,"Управление процессом загрузки данных в БКИ через CRE с опытам выстраивания инцидент-менджемента, data quality мониторинга. Выстраивание совместно с Customer...","Москва, Варшавское шоссе, 9с1Б",55.70034994144319,37.62435953505605,Тульская
78114909,Data Engineer / Разработчик,2023-03-16T08:40:38+0300,https://hh.ru/vacancy/78114909,Москва,,,,X5 Digital,https://api.hh.ru/employers/4716984,"Пожелания к твоему опыту: Понимание принципов работы СУБД и транзакционной машины, хорошие знания СУБД PostgreSQLOracle. Бизнес-ориентированность. ","...качества данных, построение витрин данных. Миграция с PostgreSQL на Greenplum + по необходимости использование других решений. Построение real-time аналитики...",,,,
78125558,Бизнес/Системный Аналитик,2023-03-16T11:03:24+0300,https://hh.ru/vacancy/78125558,Москва,,,,СБЕР,https://api.hh.ru/employers/3529,Знание основ баз данных и современных процессов и средств разработки ПО. Опыт описания data driven приложений. Знание принципов организации распределённых...,"...обработки данных, такие как: Java, Scala, Flink, Cassandra, Kafka, gRPC. Внутри платформы реализованы десятки процессов обработки и трансформации данных среди...",,,,
78123654,Продуктовый аналитик с функцией руководителя проектов,2023-03-16T10:37:40+0300,https://hh.ru/vacancy/78123654,Москва,,,,СберТройка,https://api.hh.ru/employers/5235814,"Опыт работы в Google Data Studio, опыт работы с API, знание прикладной статистики, знание python для анализа данных (pandas, numpy...","Настраивать и контролировать сбор данных, строить сквозную web&mobile аналитику. Анализировать поведение пользователей на сайтах и в мобильном приложении. ",,,,
76972780,Digital media planner / Эксперт по планированию в digital,2023-03-16T14:35:23+0300,https://hh.ru/vacancy/76972780,Москва,,,,СберМаркетинг,https://api.hh.ru/employers/3982116,,"Анализ и оценка эффективности рекламных кампаний, составление и презентация соответствующих отчетов. Выгрузка и первичная обработка данных (работа с программами: TNS...",,,,
77646637,DevOps Инженер (Удаленно),2023-03-21T13:23:20+0300,https://hh.ru/vacancy/77646637,Москва,,,,А17,https://api.hh.ru/employers/4768936,Опыт работы не менее 3 лет в области сопровождения и внедрения программного обеспечения в роли DevOps. Опыт работы с Cuber. ,"Часто применяем подходы BigData, Data Science, актуальные подходы к программному анализу данных и прогнозированию. 3. Запуск и ресурсное обеспечение команд...",,,,
78144426,Technical Integration Manager (CPA),2023-03-16T15:04:44+0300,https://hh.ru/vacancy/78144426,Москва,,,,МТС,https://api.hh.ru/employers/3776,"Есть опыт с системами мобильной (Appsflyer, Adjust, Кochava, Appmetrica) и веб аналитики (Google Analytics, GTM manager, Yandex Metrica).","Проведение технической интеграции с рекламодателями (API, Postback, Pixel, Appsflyer, Adjust). Техническая поддержка вебмастеров. Поиск и устранение неисправностей в технической интеграции. ","Москва, Проектируемый проезд № 4062, 6с2",55.692962,37.65973,Технопарк
78143867,Publisher Manager (CPA),2023-03-16T14:56:13+0300,https://hh.ru/vacancy/78143867,Москва,,,,МТС,https://api.hh.ru/employers/3776,"Есть опыт работы с рекламодателями в партнёрских CPA сетях (Ecommerce, Finance, Mobile, Edtech, Travel). Знаешь основные маркетинговые метрики: CPC, CPA...","Построение доверительных отношений с вебмастерами. Участие в развитии Партнёрской сети МТС. Формулирование задач в продукт, аналитику и отдел по работе...","Москва, Проектируемый проезд № 4062, 6с2",55.692962,37.65973,Технопарк
78146040,"Java разработчик (проект ""Антиспам"")",2023-03-16T15:33:57+0300,https://hh.ru/vacancy/78146040,Москва,,,,VK,https://api.hh.ru/employers/15478,"Отличное знание Java, основных алгоритмов и структур данных, concurrency. Хорошие теоретические знания в области распределенных систем и баз данных (опыт...","Создавать новые и развивать существующие инструменты для наших аналитиков и модераторов. Строить пайплайны для анализа новых видов контента, в том...","Москва, Ленинградский проспект, 39с79",55.796931,37.537847,Аэропорт
78143692,Account Manager (CPA),2023-03-16T14:54:03+0300,https://hh.ru/vacancy/78143692,Москва,,,,МТС,https://api.hh.ru/employers/3776,"Уверенно используешь Microsoft Excel (сводные отчёты, ВПР). Есть опыт работы с рекламодателями в партнёрских CPA сетях (Ecommerce, Finance, Mobile, Edtech...","Работа со счетами и закрывающими документами. Участие в развитии Партнёрской сети МТС. Формулирование задач в продукт, аналитику и отдел по...","Москва, Проектируемый проезд № 4062, 6с2",55.692962,37.65973,Технопарк
78131744,Product Owner (MarTech Products - Personalization),2023-03-16T12:12:53+0300,https://hh.ru/vacancy/78131744,Москва,,,,Flocktory,https://api.hh.ru/employers/711221,"Опыт создания, развития и вывода на рынок B2C продуктов или B2B продуктов, основанных на данных и...","Управление развитием продукта: Определение целей продукта, формирование его бэклога и обеспечение их прозрачности для команды и бизнеса. Выявление точек и...","Москва, улица Александра Солженицына, 23Ас1",55.744363,37.663297,
76985732,CX Manager HMI,2023-03-16T15:05:37+0300,https://hh.ru/vacancy/76985732,Москва,,,,АТОМ,https://api.hh.ru/employers/5912977,"Понимание подходов JTBD, Design Thinking, User-centered design, Data driven design. Практическое применение методологии Scrum и Agile подхода. ","...выводы, основываясь на данных. Управлять продуктовой командой: UXUI дизайнеры, TeamTech Lead, PM, разработчики, продуктовые аналитики и ресерчеры. ",,,,
78106248,Аналитик в команду продаж,2023-03-15T19:19:54+0300,https://hh.ru/vacancy/78106248,Москва,,,,Яндекс,https://api.hh.ru/employers/1740,Уверенно владеете SQL. Программируете на Python. Последние два года работали аналитиком-разработчиком. Знаете математику и основы статистики. Работали с системами...,"Разрабатывать и поддерживать процессы сбора, преобразования и хранения данных, работать с разными источниками. Проводить исследования, помогая отвечать на вопросы бизнеса. ",,,,
78138775,Product Owner (MarTech Products - Direct communications),2023-03-16T13:42:49+0300,https://hh.ru/vacancy/78138775,Москва,,,,Flocktory,https://api.hh.ru/employers/711221,"Опыт создания, развития и вывода на рынок B2C продуктов или B2B продуктов, основанных на данных и...","Управление развитием продукта: Определение целей продукта, формирование его бэклога и обеспечение их прозрачности для команды и бизнеса. Выявление точек и...","Москва, улица Александра Солженицына, 23Ас1",55.744363,37.663297,
76468098,Менеджер по работе с партнерами,2023-03-16T16:56:31+0300,https://hh.ru/vacancy/76468098,Москва,,,,МТС,https://api.hh.ru/employers/3776,"Аналитические навыки: умение сформулировать нужные срезы для проведения аналитики, способность к обработке больших массивов данных и формулированию выводов на их...","Финансово-юридическое сопровождение сотрудничества: подписание договора, сверка и согласование расхождений, передача данных по ОРД, закрытие отчетного периода и т.п.","Москва, Проектируемый проезд № 4062, 6с2",55.692962,37.65973,Технопарк
78105329,Python разработчик в команду Data Quality (Usage),2023-03-15T18:28:55+0300,https://hh.ru/vacancy/78105329,Москва,,,,АВИТО ТЕХ,https://api.hh.ru/employers/5779602,"Знаете PythonGo и умеете на нём писать production-код (мы также готовы рассматривать кандидатов, имеющих опыт не меньше 3...","...роли вам предстоит разрабатывать систему управления доступом к данным, а также развивать систему повышения качества данных. Понимаете важность безопасности данных.","Москва, Лесная улица, 7",55.778669,37.587964,Белорусская
78103204,ML engineer/Data engineer,2023-03-15T17:26:33+0300,https://hh.ru/vacancy/78103204,Москва,,,,СБЕР,https://api.hh.ru/employers/3529,Не менее 3 лет работы в качестве Data EngineerData AnalystData Scientist. Продвинутые знания SQL и Python: опыт разработки...,"Предоставление экспертной поддержки D-people (EngineerAnalystScientist) трайба в части оптимизации запросов, хранения данных и т.д. ",,,,
76843358,Python developer,2023-03-15T17:16:45+0300,https://hh.ru/vacancy/76843358,Москва,,,,МегаФон,https://api.hh.ru/employers/3127,"...с базами данных. Навыки работы с Docker. Будет плюсом: Понимание принципов разработки ML-моделей. Знания в области Big Data, Spark. ","...о данных для ML моделей. Разработка функционала, обеспечивающего быстроту и удобство для работы с библиотекой Feature Store аналитиками данных. ","Москва, Оружейный переулок, 41",55.773631,37.60558,Маяковская
77073969,Java-разработчик,2023-03-16T10:22:28+0300,https://hh.ru/vacancy/77073969,Москва,,,,"Иннотех, Группа компаний",https://api.hh.ru/employers/4649269,"Опыт использования Spring Framework (boot, mvc, data, secutity...). Опыт работы с многопоточностью и асинхронностью. Опыт работы с базами данных, умение...","...рамках микросервисной архитектуры. Проектирование интерфейсов взаимодействия с другими системами. Работа в тесном сотрудничестве со специалистами фронтенд разработки, тестирования и аналитиками.",,,,
